name,type,category,power,accuracy,pp,effect
Absorb,Grass,Special,20,100,25,User recovers half the HP inflicted on opponent.
Acid,Poison,Special,40,100,30,May lower opponent's Special Defense.
Acid Armor,Poison,Status,,,20,Sharply raises user's Defense.
Agility,Psychic,Status,,,30,Sharply raises user's Speed.
Amnesia,Psychic,Status,,,20,Sharply raises user's Special Defense.
Aurora Beam,Ice,Special,65,100,20,May lower opponent's Attack.
Barrage,Normal,Physical,15,85,20,Hits 2-5 times in one turn.
Barrier,Psychic,Status,,,20,Sharply raises user's Defense.
Bide,Normal,Physical,,,10,User takes damage for two turns then strikes back double.
Bind,Normal,Physical,15,85,20,"Traps opponent, damaging them for 4-5 turns."
Bite,Dark,Physical,60,100,25,May cause flinching.
Blizzard,Ice,Special,110,70,5,May freeze opponent.
Body Slam,Normal,Physical,85,100,15,May paralyze opponent.
Bone Club,Ground,Physical,65,85,20,May cause flinching.
Bonemerang,Ground,Physical,50,90,10,Hits twice in one turn.
Bubble,Water,Special,40,100,30,May lower opponent's Speed.
Bubble Beam,Water,Special,65,100,20,May lower opponent's Speed.
Clamp,Water,Physical,35,85,15,"Traps opponent, damaging them for 4-5 turns."
Comet Punch,Normal,Physical,18,85,15,Hits 2-5 times in one turn.
Confuse Ray,Ghost,Status,,100,10,Confuses opponent.
Confusion,Psychic,Special,50,100,25,May confuse opponent.
Constrict,Normal,Physical,10,100,35,May lower opponent's Speed by one stage.
Conversion,Normal,Status,,,30,Changes user's type to that of its first move.
Counter,Fighting,Physical,,100,20,"When hit by a Physical Attack, user strikes back with 2x power."
Crabhammer,Water,Physical,100,90,10,High critical hit ratio.
Cut,Normal,Physical,50,95,30,
Defense Curl,Normal,Status,,,40,Raises user's Defense.
Dig,Ground,Physical,80,100,10,"Digs underground on first turn, attacks on second. Can also escape from caves."
Disable,Normal,Status,,100,20,Opponent can't use its last attack for a few turns.
Dizzy Punch,Normal,Physical,70,100,10,May confuse opponent.
Double Kick,Fighting,Physical,30,100,30,Hits twice in one turn.
Double Slap,Normal,Physical,15,85,10,Hits 2-5 times in one turn.
Double Team,Normal,Status,,,15,Raises user's Evasiveness.
Double-Edge,Normal,Physical,120,100,15,User receives recoil damage.
Dragon Rage,Dragon,Special,,100,10,Always inflicts 40 HP.
Dream Eater,Psychic,Special,100,100,15,User recovers half the HP inflicted on a sleeping opponent.
Drill Peck,Flying,Physical,80,100,20,
Earthquake,Ground,Physical,100,100,10,Power is doubled if opponent is underground from using Dig.
Egg Bomb,Normal,Physical,100,75,10,
Ember,Fire,Special,40,100,25,May burn opponent.
Explosion,Normal,Physical,250,100,5,User faints.
Fire Blast,Fire,Special,110,85,5,May burn opponent.
Fire Punch,Fire,Physical,75,100,15,May burn opponent.
Fire Spin,Fire,Special,35,85,15,"Traps opponent, damaging them for 4-5 turns."
Fissure,Ground,Physical,,30,5,"One-Hit-KO, if it hits."
Flamethrower,Fire,Special,90,100,15,May burn opponent.
Flash,Normal,Status,,100,20,Lowers opponent's Accuracy.
Fly,Flying,Physical,90,95,15,"Flies up on first turn, attacks on second turn."
Focus Energy,Normal,Status,,,30,Increases critical hit ratio.
Fury Attack,Normal,Physical,15,85,20,Hits 2-5 times in one turn.
Fury Swipes,Normal,Physical,18,80,15,Hits 2-5 times in one turn.
Glare,Normal,Status,,100,30,Paralyzes opponent.
Growl,Normal,Status,,100,40,Lowers opponent's Attack.
Growth,Normal,Status,,,20,Raises user's Attack and Special Attack.
Guillotine,Normal,Physical,,30,5,"One-Hit-KO, if it hits."
Gust,Flying,Special,40,100,35,Hits Pokémon using Fly/Bounce with double power.
Harden,Normal,Status,,,30,Raises user's Defense.
Haze,Ice,Status,,,30,Resets all stat changes.
Headbutt,Normal,Physical,70,100,15,May cause flinching.
High Jump Kick,Fighting,Physical,130,90,10,"If it misses, the user loses half their HP."
Horn Attack,Normal,Physical,65,100,25,
Horn Drill,Normal,Physical,,30,5,"One-Hit-KO, if it hits."
Hydro Pump,Water,Special,110,80,5,
Hyper Beam,Normal,Special,150,90,5,User must recharge next turn.
Hyper Fang,Normal,Physical,80,90,15,May cause flinching.
Hypnosis,Psychic,Status,,60,20,Puts opponent to sleep.
Ice Beam,Ice,Special,90,100,10,May freeze opponent.
Ice Punch,Ice,Physical,75,100,15,May freeze opponent.
Jump Kick,Fighting,Physical,100,95,10,"If it misses, the user loses half their HP."
Karate Chop,Fighting,Physical,50,100,25,High critical hit ratio.
Kinesis,Psychic,Status,,80,15,Lowers opponent's Accuracy.
Leech Life,Bug,Physical,80,100,10,User recovers half the HP inflicted on opponent.
Leech Seed,Grass,Status,,90,10,Drains HP from opponent each turn.
Leer,Normal,Status,,100,30,Lowers opponent's Defense.
Lick,Ghost,Physical,30,100,30,May paralyze opponent.
Light Screen,Psychic,Status,,,30,Halves damage from Special attacks for 5 turns.
Lovely Kiss,Normal,Status,,75,10,Puts opponent to sleep.
Low Kick,Fighting,Physical,,100,20,"The heavier the opponent, the stronger the attack."
Meditate,Psychic,Status,,,40,Raises user's Attack.
Mega Drain,Grass,Special,40,100,15,User recovers half the HP inflicted on opponent.
Mega Kick,Normal,Physical,120,75,5,
Mega Punch,Normal,Physical,80,85,20,
Metronome,Normal,Status,,,10,User performs almost any move in the game at random.
Mimic,Normal,Status,,,10,Copies the opponent's last move.
Minimize,Normal,Status,,,10,Sharply raises user's Evasiveness.
Mirror Move,Flying,Status,,,20,User performs the opponent's last move.
Mist,Ice,Status,,,30,User's stats cannot be changed for a period of time.
Night Shade,Ghost,Special,,100,15,Inflicts damage equal to user's level.
Pay Day,Normal,Physical,40,100,20,A small amount of money is gained after the battle resolves.
Peck,Flying,Physical,35,100,35,
Petal Dance,Grass,Special,120,100,10,User attacks for 2-3 turns but then becomes confused.
Pin Missile,Bug,Physical,25,95,20,Hits 2-5 times in one turn.
Poison Gas,Poison,Status,,90,40,Poisons opponent.
Poison Powder,Poison,Status,,75,35,Poisons opponent.
Poison Sting,Poison,Physical,15,100,35,May poison the opponent.
Pound,Normal,Physical,40,100,35,
Psybeam,Psychic,Special,65,100,20,May confuse opponent.
Psychic,Psychic,Special,90,100,10,May lower opponent's Special Defense.
Psywave,Psychic,Special,,100,15,Inflicts damage 50-150% of user's level.
Quick Attack,Normal,Physical,40,100,30,User attacks first.
Rage,Normal,Physical,20,100,20,Raises user's Attack when hit.
Razor Leaf,Grass,Physical,55,95,25,High critical hit ratio.
Razor Wind,Normal,Special,80,100,10,"Charges on first turn, attacks on second. High critical hit ratio."
Recover,Normal,Status,,,10,User recovers half its max HP.
Reflect,Psychic,Status,,,20,Halves damage from Physical attacks for 5 turns.
Rest,Psychic,Status,,,10,"User sleeps for 2 turns, but user is fully healed."
Roar,Normal,Status,,,20,"In battles, the opponent switches. In the wild, the Pokémon runs."
Rock Slide,Rock,Physical,75,90,10,May cause flinching.
Rock Throw,Rock,Physical,50,90,15,
Rolling Kick,Fighting,Physical,60,85,15,May cause flinching.
Sand Attack,Ground,Status,,100,15,Lowers opponent's Accuracy.
Scratch,Normal,Physical,40,100,35,
Screech,Normal,Status,,85,40,Sharply lowers opponent's Defense.
Seismic Toss,Fighting,Physical,,100,20,Inflicts damage equal to user's level.
Self-Destruct,Normal,Physical,200,100,5,User faints.
Sharpen,Normal,Status,,,30,Raises user's Attack.
Sing,Normal,Status,,55,15,Puts opponent to sleep.
Skull Bash,Normal,Physical,130,100,10,"Raises Defense on first turn, attacks on second."
Sky Attack,Flying,Physical,140,90,5,"Charges on first turn, attacks on second. May cause flinching. High critical hit ratio."
Slam,Normal,Physical,80,75,20,
Slash,Normal,Physical,70,100,20,High critical hit ratio.
Sleep Powder,Grass,Status,,75,15,Puts opponent to sleep.
Sludge,Poison,Special,65,100,20,May poison opponent.
Smog,Poison,Special,30,70,20,May poison opponent.
Smokescreen,Normal,Status,,100,20,Lowers opponent's Accuracy.
Soft-Boiled,Normal,Status,,,10,User recovers half its max HP.
Solar Beam,Grass,Special,120,100,10,"Charges on first turn, attacks on second."
Sonic Boom,Normal,Special,,90,20,Always inflicts 20 HP.
Spike Cannon,Normal,Physical,20,100,15,Hits 2-5 times in one turn.
Splash,Normal,Status,,,40,Doesn't do ANYTHING.
Spore,Grass,Status,,100,15,Puts opponent to sleep.
Stomp,Normal,Physical,65,100,20,May cause flinching.
Strength,Normal,Physical,80,100,15,
String Shot,Bug,Status,,95,40,Sharply lowers opponent's Speed.
Struggle,Normal,Physical,50,,,Only usable when all PP are gone. Hurts the user.
Stun Spore,Grass,Status,,75,30,Paralyzes opponent.
Submission,Fighting,Physical,80,80,20,User receives recoil damage.
Substitute,Normal,Status,,,10,Uses HP to creates a decoy that takes hits.
Super Fang,Normal,Physical,,90,10,Always takes off half of the opponent's HP.
Supersonic,Normal,Status,,55,20,Confuses opponent.
Surf,Water,Special,90,100,15,Hits all adjacent Pokémon.
Swift,Normal,Special,60,?,20,Ignores Accuracy and Evasiveness.
Swords Dance,Normal,Status,,,20,Sharply raises user's Attack.
Tackle,Normal,Physical,40,100,35,
Tail Whip,Normal,Status,,100,30,Lowers opponent's Defense.
Take Down,Normal,Physical,90,85,20,User receives recoil damage.
Teleport,Psychic,Status,,,20,Allows user to flee wild battles; also warps player to last PokéCenter.
Thrash,Normal,Physical,120,100,10,User attacks for 2-3 turns but then becomes confused.
Thunder,Electric,Special,110,70,10,May paralyze opponent.
Thunder Punch,Electric,Physical,75,100,15,May paralyze opponent.
Thunder Shock,Electric,Special,40,100,30,May paralyze opponent.
Thunder Wave,Electric,Status,,90,20,Paralyzes opponent.
Thunderbolt,Electric,Special,90,100,15,May paralyze opponent.
Toxic,Poison,Status,,90,10,Badly poisons opponent.
Transform,Normal,Status,,,10,User takes on the form and attacks of the opponent.
Tri Attack,Normal,Special,80,100,10,"May paralyze, burn or freeze opponent."
Twineedle,Bug,Physical,25,100,20,Hits twice in one turn. May poison opponent.
Vine Whip,Grass,Physical,45,100,25,
Vise Grip,Normal,Physical,55,100,30,
Water Gun,Water,Special,40,100,25,
Waterfall,Water,Physical,80,100,15,May cause flinching.
Whirlwind,Normal,Status,,,20,"In battles, the opponent switches. In the wild, the Pokémon runs."
Wing Attack,Flying,Physical,60,100,35,
Withdraw,Water,Status,,,40,Raises user's Defense.
Wrap,Normal,Physical,15,90,20,"Traps opponent, damaging them for 4-5 turns."
Aeroblast,Flying,Special,100,95,5,High critical hit ratio.
Ancient Power,Rock,Special,60,100,5,May raise all user's stats at once.
Attract,Normal,Status,,100,15,"If opponent is the opposite gender, it's less likely to attack."
Baton Pass,Normal,Status,,,40,User switches out and gives stat changes to the incoming Pokémon.
Beat Up,Dark,Physical,,100,10,Each Pokémon in your party attacks.
Belly Drum,Normal,Status,,,10,"User loses 50% of its max HP, but Attack raises to maximum."
Bone Rush,Ground,Physical,25,90,10,Hits 2-5 times in one turn.
Charm,Fairy,Status,,100,20,Sharply lowers opponent's Attack.
Conversion 2,Normal,Status,,,30,User changes type to become resistant to opponent's last move.
Cotton Spore,Grass,Status,,100,40,Sharply lowers opponent's Speed.
Cross Chop,Fighting,Physical,100,80,5,High critical hit ratio.
Crunch,Dark,Physical,80,100,15,May lower opponent's Defense.
Curse,Ghost,Status,,,10,"Ghosts lose 50% of max HP and curse the opponent; Non-Ghosts raise Attack, Defense and lower Speed."
Destiny Bond,Ghost,Status,,,5,"If the user faints, the opponent also faints."
Detect,Fighting,Status,,,5,"Protects the user, but may fail if used consecutively."
Dragon Breath,Dragon,Special,60,100,20,May paralyze opponent.
Dynamic Punch,Fighting,Physical,100,50,5,Confuses opponent.
Encore,Normal,Status,,100,5,Forces opponent to keep using its last move for 3 turns.
Endure,Normal,Status,,,10,"Always left with at least 1 HP, but may fail if used consecutively."
Extreme Speed,Normal,Physical,80,100,5,User attacks first.
False Swipe,Normal,Physical,40,100,40,Always leaves opponent with at least 1 HP.
Feint Attack,Dark,Physical,60,?,20,Ignores Accuracy and Evasiveness.
Flail,Normal,Physical,,100,15,"The lower the user's HP, the higher the power."
Flame Wheel,Fire,Physical,60,100,25,May burn opponent.
Foresight,Normal,Status,,,40,"Resets opponent's Evasiveness, Normal-type and Fighting-type attacks can now hit Ghosts, and Ghost-type attacks hit Normal."
Frustration,Normal,Physical,,100,20,Power decreases with higher Friendship.
Fury Cutter,Bug,Physical,40,95,20,Power increases each turn.
Future Sight,Psychic,Special,120,100,10,Damage occurs 2 turns later.
Giga Drain,Grass,Special,75,100,10,User recovers half the HP inflicted on opponent.
Heal Bell,Normal,Status,,,5,Heals the user's party's status conditions.
Hidden Power,Normal,Special,60,100,15,Type and power depends on user's IVs.
Icy Wind,Ice,Special,55,95,15,Lowers opponent's Speed.
Iron Tail,Steel,Physical,100,75,15,May lower opponent's Defense.
Lock-On,Normal,Status,,,5,User's next attack is guaranteed to hit.
Mach Punch,Fighting,Physical,40,100,30,User attacks first.
Magnitude,Ground,Physical,,100,30,Hits with random power.
Mean Look,Normal,Status,,,5,Opponent cannot flee or switch.
Megahorn,Bug,Physical,120,85,10,
Metal Claw,Steel,Physical,50,95,35,May raise user's Attack.
Milk Drink,Normal,Status,,,10,User recovers half its max HP.
Mind Reader,Normal,Status,,,5,User's next attack is guaranteed to hit.
Mirror Coat,Psychic,Special,,100,20,"When hit by a Special Attack, user strikes back with 2x power."
Moonlight,Fairy,Status,,,5,User recovers HP. Amount varies with the weather.
Morning Sun,Normal,Status,,,5,User recovers HP. Amount varies with the weather.
Mud-Slap,Ground,Special,20,100,10,Lowers opponent's Accuracy.
Nightmare,Ghost,Status,,100,15,The sleeping opponent loses 25% of its max HP each turn.
Octazooka,Water,Special,65,85,10,May lower opponent's Accuracy.
Outrage,Dragon,Physical,120,100,10,User attacks for 2-3 turns but then becomes confused.
Pain Split,Normal,Status,,,20,The user's and opponent's HP becomes the average of both.
Perish Song,Normal,Status,,,5,Any Pokémon in play when this attack is used faints in 3 turns.
Powder Snow,Ice,Special,40,100,25,May freeze opponent.
Present,Normal,Physical,,90,15,Either deals damage or heals.
Protect,Normal,Status,,,10,"Protects the user, but may fail if used consecutively."
Psych Up,Normal,Status,,,10,Copies the opponent's stat changes.
Pursuit,Dark,Physical,40,100,20,Double power if the opponent is switching out.
Rain Dance,Water,Status,,,5,Makes it rain for 5 turns.
Rapid Spin,Normal,Physical,50,100,40,Raises user's Speed and removes entry hazards and trap move effects.
Return,Normal,Physical,,100,20,Power increases with higher Friendship.
Reversal,Fighting,Physical,,100,15,"The lower the user's HP, the higher the power."
Rock Smash,Fighting,Physical,40,100,15,May lower opponent's Defense.
Rollout,Rock,Physical,30,90,20,Doubles in power each turn for 5 turns.
Sacred Fire,Fire,Physical,100,95,5,May burn opponent.
Safeguard,Normal,Status,,,25,The user's party is protected from status conditions.
Sandstorm,Rock,Status,,,10,Creates a sandstorm for 5 turns.
Scary Face,Normal,Status,,100,10,Sharply lowers opponent's Speed.
Shadow Ball,Ghost,Special,80,100,15,May lower opponent's Special Defense.
Sketch,Normal,Status,,,1,Permanently copies the opponent's last move.
Sleep Talk,Normal,Status,,,10,User performs one of its own moves while sleeping.
Sludge Bomb,Poison,Special,90,100,10,May poison opponent.
Snore,Normal,Special,50,100,15,Can only be used if asleep. May cause flinching.
Spark,Electric,Physical,65,100,20,May paralyze opponent.
Spider Web,Bug,Status,,,10,Opponent cannot escape/switch.
Spikes,Ground,Status,,,20,Hurts opponents when they switch into battle.
Spite,Ghost,Status,,100,10,The opponent's last move loses 2-5 PP.
Steel Wing,Steel,Physical,70,90,25,May raise user's Defense.
Sunny Day,Fire,Status,,,5,Makes it sunny for 5 turns.
Swagger,Normal,Status,,85,15,"Opponent becomes confused, but its Attack is sharply raised."
Sweet Kiss,Fairy,Status,,75,10,Confuses opponent.
Sweet Scent,Normal,Status,,100,20,Lowers opponent's Evasiveness.
Synthesis,Grass,Status,,,5,User recovers HP. Amount varies with the weather.
Thief,Dark,Physical,60,100,25,Also steals opponent's held item.
Triple Kick,Fighting,Physical,10,90,10,Hits thrice in one turn at increasing power.
Twister,Dragon,Special,40,100,20,May cause flinching. Hits Pokémon using Fly/Bounce with double power.
Vital Throw,Fighting,Physical,70,?,10,"User attacks last, but ignores Accuracy and Evasiveness."
Whirlpool,Water,Special,35,85,15,"Traps opponent, damaging them for 4-5 turns."
Zap Cannon,Electric,Special,120,50,5,Paralyzes opponent.
Aerial Ace,Flying,Physical,60,?,20,Ignores Accuracy and Evasiveness.
Air Cutter,Flying,Special,60,95,25,High critical hit ratio.
Arm Thrust,Fighting,Physical,15,100,20,Hits 2-5 times in one turn.
Aromatherapy,Grass,Status,,,5,Cures all status problems in your party.
Assist,Normal,Status,,,20,User performs a move known by its allies at random.
Astonish,Ghost,Physical,30,100,15,May cause flinching.
Blast Burn,Fire,Special,150,90,5,User must recharge next turn.
Blaze Kick,Fire,Physical,85,90,10,High critical hit ratio. May burn opponent.
Block,Normal,Status,,,5,Opponent cannot flee or switch.
Bounce,Flying,Physical,85,85,5,"Springs up on first turn, attacks on second. May paralyze opponent."
Brick Break,Fighting,Physical,75,100,15,Breaks through Reflect and Light Screen barriers.
Bulk Up,Fighting,Status,,,20,Raises user's Attack and Defense.
Bullet Seed,Grass,Physical,25,100,30,Hits 2-5 times in one turn.
Calm Mind,Psychic,Status,,,20,Raises user's Special Attack and Special Defense.
Camouflage,Normal,Status,,,20,Changes user's type according to the location.
Charge,Electric,Status,,,20,Raises user's Special Defense and next Electric move's power increases.
Cosmic Power,Psychic,Status,,,20,Raises user's Defense and Special Defense.
Covet,Normal,Physical,60,100,25,Opponent's item is stolen by the user.
Crush Claw,Normal,Physical,75,95,10,May lower opponent's Defense.
Dive,Water,Physical,80,100,10,"Dives underwater on first turn, attacks on second turn."
Doom Desire,Steel,Special,140,100,5,Damage occurs 2 turns later.
Dragon Claw,Dragon,Physical,80,100,15,
Dragon Dance,Dragon,Status,,,20,Raises user's Attack and Speed.
Endeavor,Normal,Physical,,100,5,Reduces opponent's HP to same as user's.
Eruption,Fire,Special,150,100,5,Stronger when the user's HP is higher.
Extrasensory,Psychic,Special,80,100,20,May cause flinching.
Facade,Normal,Physical,70,100,20,"Power doubles if user is burned, poisoned, or paralyzed."
Fake Out,Normal,Physical,40,100,10,"User attacks first, foe flinches. Only usable on first turn."
Fake Tears,Dark,Status,,100,20,Sharply lowers opponent's Special Defense.
Feather Dance,Flying,Status,,100,15,Sharply lowers opponent's Attack.
Flatter,Dark,Status,,100,15,"Confuses opponent, but raises its Special Attack by two stages."
Focus Punch,Fighting,Physical,150,100,20,"If the user is hit before attacking, it flinches instead."
Follow Me,Normal,Status,,,20,"In Double Battle, the user takes all the attacks."
Frenzy Plant,Grass,Special,150,90,5,User must recharge next turn.
Grass Whistle,Grass,Status,,55,15,Puts opponent to sleep.
Grudge,Ghost,Status,,,5,"If the users faints after using this move, the PP for the opponent's last move is depleted."
Hail,Ice,Status,,,10,Non-Ice types are damaged for 5 turns.
Heat Wave,Fire,Special,95,90,10,May burn opponent.
Helping Hand,Normal,Status,,,20,"In Double Battles, boosts the power of the partner's move."
Howl,Normal,Status,,,40,Raises Attack of allies.
Hydro Cannon,Water,Special,150,90,5,User must recharge next turn.
Hyper Voice,Normal,Special,90,100,10,
Ice Ball,Ice,Physical,30,90,20,Doubles in power each turn for 5 turns.
Icicle Spear,Ice,Physical,25,100,30,Hits 2-5 times in one turn.
Imprison,Psychic,Status,,,10,Opponent is unable to use moves that the user also knows.
Ingrain,Grass,Status,,,20,User restores HP each turn. User cannot escape/switch.
Iron Defense,Steel,Status,,,15,Sharply raises user's Defense.
Knock Off,Dark,Physical,65,100,20,Removes opponent's held item for the rest of the battle.
Leaf Blade,Grass,Physical,90,100,15,High critical hit ratio.
Luster Purge,Psychic,Special,70,100,5,May lower opponent's Special Defense.
Magic Coat,Psychic,Status,,,15,Reflects moves that cause status conditions back to the attacker.
Magical Leaf,Grass,Special,60,?,20,Ignores Accuracy and Evasiveness.
Memento,Dark,Status,,100,10,"User faints, sharply lowers opponent's Attack and Special Attack."
Metal Sound,Steel,Status,,85,40,Sharply lowers opponent's Special Defense.
Meteor Mash,Steel,Physical,90,90,10,May raise user's Attack.
Mist Ball,Psychic,Special,70,100,5,May lower opponent's Special Attack.
Mud Shot,Ground,Special,55,95,15,Lowers opponent's Speed.
Mud Sport,Ground,Status,,,15,Weakens the power of Electric-type moves.
Muddy Water,Water,Special,90,85,10,May lower opponent's Accuracy.
Nature Power,Normal,Status,,,20,Uses a certain move based on the current terrain.
Needle Arm,Grass,Physical,60,100,15,May cause flinching.
Odor Sleuth,Normal,Status,,,40,"Resets opponent's Evasiveness, Normal-type and Fighting-type attacks can now hit Ghosts, and Ghost-type attacks hit Normal."
Overheat,Fire,Special,130,90,5,Sharply lowers user's Special Attack.
Poison Fang,Poison,Physical,50,100,15,May badly poison opponent.
Poison Tail,Poison,Physical,50,100,25,High critical hit ratio. May poison opponent.
Psycho Boost,Psychic,Special,140,90,5,Sharply lowers user's Special Attack.
Recycle,Normal,Status,,,10,User's used hold item is restored.
Refresh,Normal,Status,,,20,"Cures paralysis, poison, and burns."
Revenge,Fighting,Physical,60,100,10,Power increases if user was hit first.
Rock Blast,Rock,Physical,25,90,10,Hits 2-5 times in one turn.
Rock Tomb,Rock,Physical,60,95,15,Lowers opponent's Speed.
Role Play,Psychic,Status,,,10,User copies the opponent's Ability.
Sand Tomb,Ground,Physical,35,85,15,"Traps opponent, damaging them for 4-5 turns."
Secret Power,Normal,Physical,70,100,20,Effects of the attack vary with the location.
Shadow Punch,Ghost,Physical,60,?,20,Ignores Accuracy and Evasiveness.
Sheer Cold,Ice,Special,,30,5,"One-Hit-KO, if it hits."
Shock Wave,Electric,Special,60,?,20,Ignores Accuracy and Evasiveness.
Signal Beam,Bug,Special,75,100,15,May confuse opponent.
Silver Wind,Bug,Special,60,100,5,May raise all stats of user at once.
Skill Swap,Psychic,Status,,,10,The user swaps Abilities with the opponent.
Sky Uppercut,Fighting,Physical,85,90,15,"Hits the opponent, even during Fly."
Slack Off,Normal,Status,,,10,User recovers half its max HP.
Smelling Salts,Normal,Physical,70,100,10,"Power doubles if opponent is paralyzed, but cures it."
Snatch,Dark,Status,,,10,Steals the effects of the opponent's next move.
Spit Up,Normal,Special,,100,10,Power depends on how many times the user performed Stockpile.
Stockpile,Normal,Status,,,20,Stores energy for use with Spit Up and Swallow.
Superpower,Fighting,Physical,120,100,5,Lowers user's Attack and Defense.
Swallow,Normal,Status,,,10,"The more times the user has performed Stockpile, the more HP is recovered."
Tail Glow,Bug,Status,,,20,Drastically raises user's Special Attack.
Taunt,Dark,Status,,100,20,Opponent can only use moves that attack.
Teeter Dance,Normal,Status,,100,20,Confuses all Pokémon.
Tickle,Normal,Status,,100,20,Lowers opponent's Attack and Defense.
Torment,Dark,Status,,100,15,Opponent cannot use the same move in a row.
Trick,Psychic,Status,,100,10,Swaps held items with the opponent.
Uproar,Normal,Special,90,100,10,User attacks for 3 turns and prevents sleep.
Volt Tackle,Electric,Physical,120,100,15,User receives recoil damage. May paralyze opponent.
Water Pulse,Water,Special,60,100,20,May confuse opponent.
Water Sport,Water,Status,,,15,Weakens the power of Fire-type moves.
Water Spout,Water,Special,150,100,5,"The higher the user's HP, the higher the damage caused."
Weather Ball,Normal,Special,50,100,10,Move's power and type changes with the weather.
Will-O-Wisp,Fire,Status,,85,15,Burns opponent.
Wish,Normal,Status,,,10,The user recovers HP in the following turn.
Yawn,Normal,Status,,,10,Puts opponent to sleep in the next turn.
Acupressure,Normal,Status,,,30,Sharply raises a random stat.
Air Slash,Flying,Special,75,95,15,May cause flinching.
Aqua Jet,Water,Physical,40,100,20,User attacks first.
Aqua Ring,Water,Status,,,20,Restores a little HP each turn.
Aqua Tail,Water,Physical,90,90,10,
Assurance,Dark,Physical,60,100,10,Power doubles if opponent already took damage in the same turn.
Attack Order,Bug,Physical,90,100,15,High critical hit ratio.
Aura Sphere,Fighting,Special,80,?,20,Ignores Accuracy and Evasiveness.
Avalanche,Ice,Physical,60,100,10,Power doubles if user took damage first.
Brave Bird,Flying,Physical,120,100,15,User receives recoil damage.
Brine,Water,Special,65,100,10,Power doubles if opponent's HP is less than 50%.
Bug Bite,Bug,Physical,60,100,20,Receives the effect from the opponent's held berry.
Bug Buzz,Bug,Special,90,100,10,May lower opponent's Special Defense.
Bullet Punch,Steel,Physical,40,100,30,User attacks first.
Captivate,Normal,Status,,100,20,Sharply lowers opponent's Special Attack if opposite gender.
Charge Beam,Electric,Special,50,90,10,May raise user's Special Attack.
Chatter,Flying,Special,65,100,20,Confuses opponent.
Close Combat,Fighting,Physical,120,100,5,Lowers user's Defense and Special Defense.
Copycat,Normal,Status,,,20,Copies opponent's last move.
Cross Poison,Poison,Physical,70,100,20,High critical hit ratio. May poison opponent.
Crush Grip,Normal,Physical,,100,5,More powerful when opponent has higher HP.
Dark Pulse,Dark,Special,80,100,15,May cause flinching.
Dark Void,Dark,Status,,50,10,Puts all adjacent opponents to sleep.
Defend Order,Bug,Status,,,10,Raises user's Defense and Special Defense.
