name,type,category,power,accuracy,pp,effect
Stomping Tantrum,Ground,Physical,75,100,10,"Driven by frustration, the user attacks the target. If the user's previous move has failed, the power of this move doubles."
Strength Sap,Grass,Status,,100,10,The user restores its HP by the same amount as the target's Attack stat. It also lowers the target's Attack stat.
Subzero Slammer,Ice,,,,1,Ice type Z-Move.
Sunsteel Strike,Steel,Physical,100,100,5,Ignores the target's ability.
Supersonic Skystrike,Flying,,,,1,Flying type Z-Move.
Tearful Look,Normal,Status,,,20,The user gets teary eyed to make the target lose its combative spirit. This lowers the target's Attack and Sp. Atk stats.
Tectonic Rage,Ground,,,,1,Ground type Z-Move.
Throat Chop,Dark,Physical,80,100,15,Prevents use of sound moves for two turns.
Toxic Thread,Poison,Status,,100,20,Lowers target's Speed.
Trop Kick,Grass,Physical,70,100,15,Lowers opponent's Attack.
Twinkle Tackle,Fairy,,,,1,Fairy type Z-Move.
Veevee Volley,Normal,Physical,,?,20,Power increases when player's bond is stronger.
Zing Zap,Electric,Physical,80,100,10,May cause flinching.
Zippy Zap,Electric,Physical,50,100,15,Always results in a critical hit.
Apple Acid,Grass,Special,80,100,10,Lowers target's Special Defense.
Aura Wheel,Electric,Physical,110,100,10,Changes type based on Morpeko's Mode.
Behemoth Bash,Steel,Physical,100,100,5,Damage doubles if user is Dynamaxed.
Behemoth Blade,Steel,Physical,100,100,5,Damage doubles if user is Dynamaxed.
Body Press,Fighting,Physical,80,100,10,"The higher the user's Defense, the stronger the attack."
Bolt Beak,Electric,Physical,85,100,10,"If the user attacks before the target, the power of this move is doubled."
Branch Poke,Grass,Physical,40,100,40,
Breaking Swipe,Dragon,Physical,60,100,15,Hits multiple opponents and lowers their attack.
Burning Jealousy,Fire,,,,,"Hits all opponents, and burns any that have had their stats boosted."
Clangorous Soul,Dragon,Status,,100,5,Raises all user's stats but loses HP.
Coaching,Fighting,Status,,,10,Boosts Attack and Defense of a teammate.
Corrosive Gas,Poison,Status,,100,40,Removes opponent's items.
Court Change,Normal,Status,,100,10,Swaps the effects on either side of the field.
Decorate,Fairy,Status,,,15,Sharply raises target's Attack and Special Attack.
Dragon Darts,Dragon,Physical,50,100,10,User attacks twice.
Dragon Energy,,,,,,"The higher the user's HP, the higher the power."
Drum Beating,Grass,Physical,80,100,10,Lowers opponent's Speed.
Dual Wingbeat,Flying,Physical,40,90,10,The user slams the target with its wings. The target is hit twice in a row.
Dynamax Cannon,Dragon,Special,100,100,5,Damage doubles if opponent is Dynamaxed.
Eternabeam,Dragon,Special,160,90,5,User can't move on the next turn.
Expanding Force,Psychic,Special,80,100,10,Increases power and hits all opponents on Psychic Terrain.
False Surrender,Dark,Physical,80,?,10,Ignores Accuracy and Evasiveness.
Fiery Wrath,Dark,Special,,,,May cause flinching.
Fishious Rend,Water,Physical,85,100,10,"If the user attacks before the target, the power of this move is doubled."
Flip Turn,Water,Physical,60,100,20,"After making its attack, the user rushes back to switch places with a party Pokémon in waiting."
Freezing Glare,Psychic,Special,,,,May freeze opponent.
G-Max Befuddle,Bug,,,,,"Butterfree-exclusive G-Max Move. Poisons, paralyzes, or puts opponent to sleep."
G-Max Cannonade,Water,,,,,Blastoise-exclusive G-Max Move. Damages non-Water types for 4 turns.
G-Max Centiferno,Fire,,,,,Centiskorch-exclusive G-Max Move. Traps opponents for 4-5 turns.
G-Max Chi Strike,Fighting,,,,,Machamp-exclusive G-Max Move. Increases critical hit ratio.
G-Max Cuddle,Normal,,,,,Eevee-exclusive G-Max Move. Infatuates opponents.
G-Max Depletion,Dragon,,,,,Duraludon-exclusive G-Max Move. Reduces opponent's PP.
G-Max Drum Solo,Grass,,,,,Rillaboom-exclusive G-Max Move. Ignores target's ability.
G-Max Finale,Fairy,,,,,Alcremie-exclusive G-Max Move. Heals the user's team.
G-Max Fireball,Fire,,,,,Cinderace-exclusive G-Max Move. Ignores target's ability.
G-Max Foam Burst,Water,,,,,Kingler-exclusive G-Max Move. Harshly lowers opponents' Speed.
G-Max Gold Rush,Normal,,,,,Meowth-exclusive G-Max Move. Confuses opponents and earns more money.
G-Max Gravitas,Psychic,,,,,Orbeetle-exclusive G-Max Move. Summons Gravity for 5 turns.
G-Max Hydrosnipe,Water,,,,,Inteleon-exclusive G-Max Move. Ignores target's ability.
G-Max Malodor,Poison,,,,,Garbodor-exclusive G-Max Move. Poisons opponents.
G-Max Meltdown,Steel,,,,,Melmetal-exclusive G-Max Move. Prevents opponents using the same move twice in a row.
G-Max One Blow,Dark,,,,,Urshifu Single-Strike Style-exclusive G-Max Move. Strikes through Max Guard and Protect.
G-Max Rapid Flow,Water,,,,,Urshifu Rapid-Strike Style-exclusive G-Max Move. Strikes through Max Guard and Protect.
G-Max Replenish,Normal,,,,,Snorlax-exclusive G-Max Move. Recycles Berries.
G-Max Resonance,Ice,,,,,Lapras-exclusive G-Max Move. Reduces damage for 5 turns.
G-Max Sandblast,Ground,,,,,Sandaconda-exclusive G-Max Move. Traps opponents for 4-5 turns.
G-Max Smite,Fairy,,,,,Hatterene-exclusive G-Max Move. Confuses opponents.
G-Max Snooze,Dark,,,,,Grimmsnarl-exclusive G-Max Move. Makes opponents drowsy.
G-Max Steelsurge,Steel,,,,,Copperajah-exclusive G-Max Move. Sets up Spikes on the field.
G-Max Stonesurge,Water,,,,,Drednaw-exclusive G-Max Move. Sets up Stealth Rock.
G-Max Stun Shock,Electric,,,,,Toxtricity-exclusive G-Max Move. Poisons or paralyzes opponents.
G-Max Sweetness,Grass,,,,,Appletun-exclusive G-Max Move. Heals status conditions of user's team.
G-Max Tartness,Grass,,,,,Flapple-exclusive G-Max Move. Reduces opponents' evasiveness.
G-Max Terror,Ghost,,,,,Gengar-exclusive G-Max Move. Prevents opponent from switching out.
G-Max Vine Lash,Grass,,,,,Venusaur-exclusive G-Max Move. Damages non-Grass types for 4 turns.
G-Max Volcalith,Rock,,,,,Coalossal-exclusive G-Max Move. Deals damage for 4 turns.
G-Max Volt Crash,Electric,,,,,Pikachu-exclusive G-Max Move. Paralyzes opponents.
G-Max Wildfire,Fire,,,,,Charizard-exclusive G-Max Move. Damages non-Fire types for 4 turns.
G-Max Wind Rage,Flying,,,,,Corviknight-exclusive G-Max Move. Removes battlefield hazards.
Grassy Glide,Grass,,,,,High priority during Grassy Terrain.
Grav Apple,Grass,Physical,80,100,10,Lowers the opponent's Defense stat.
Jaw Lock,Dark,Physical,80,100,10,Prevents user and opponent from switching out.
Jungle Healing,Grass,Status,,,,Restores team's HP and cures status conditions.
Lash Out,Dark,Physical,75,100,5,Double power if stats were lowered during the turn.
Life Dew,Water,Status,,,10,User and teammates recover HP.
Magic Powder,Psychic,Status,,100,20,Changes target's type to Psychic.
Max Airstream,Flying,,,,,Flying type Dynamax move. Raises the team's Speed.
Max Darkness,Dark,,,,,Dark type Dynamax move. Lowers the target's Special Defense.
Max Flare,Fire,,,,,Fire type Dynamax move. Summons harsh sunlight.
Max Flutterby,Bug,,,,,Bug type Dynamax move. Lowers the target's Special Attack.
Max Geyser,Water,,,,,Water type Dynamax move. Summons heavy rain.
Max Guard,Normal,,,,,Status category Dynamax move. Protects the user.
Max Hailstorm,Ice,,,,,Ice type Dynamax move. Summons hail.
Max Knuckle,Fighting,,,,,Fighting type Dynamax move. Increases the team's Attack.
Max Lightning,Electric,,,,,Electric type Dynamax move. Summons Electric Terrain.
Max Mindstorm,Psychic,,,,,Psychic type Dynamax move. Summons Psychic Terrain.
Max Ooze,Poison,,,,,Poison type Dynamax move. Increases the team's Special Attack.
Max Overgrowth,Grass,,,,,Grass type Dynamax move. Summons Grassy Terrain.
Max Phantasm,Ghost,,,,,Ghost type Dynamax move. Lowers the target's Defense.
Max Quake,Ground,,,,,Ground type Dynamax move. Increases the team's Special Defense.
Max Rockfall,Rock,,,,,Rock type Dynamax move. Summons a sandstorm.
Max Starfall,Fairy,,,,,Fairy type Dynamax move. Summons Misty Terrain.
Max Steelspike,Steel,,,,,Steel type Dynamax move. Raises the team's Defense.
Max Strike,Normal,,,,,Normal type Dynamax move. Lowers the target's Speed.
Max Wyrmwind,Dragon,,,,,Dragon type Dynamax move. Lowers the target's Attack.
Meteor Assault,Fighting,Physical,150,100,5,User must recharge next turn.
Meteor Beam,Rock,Special,120,90,10,"User gathers space power and boosts its Sp. Atk stat, then attacks the target on the next turn."
Misty Explosion,Fairy,Special,100,100,5,Power increases on Misty Terrain.
No Retreat,Fighting,Status,,,5,Raises all stats but user cannot switch out.
Obstruct,Dark,Status,,100,10,Protects the user and sharply lowers Defence on contact.
Octolock,Fighting,Status,,100,15,"Lowers opponent's Defense and Special Defense every turn, and they cannot flee or switch out."
Overdrive,Electric,Special,80,100,10,
Poltergeist,Ghost,Physical,110,90,5,Fails if the target doesnt have an item.
Pyro Ball,Fire,Physical,120,90,5,May burn opponent.
Rising Voltage,Electric,Special,70,100,20,Power doubles on Electric Terrain.
Scale Shot,Dragon,Physical,25,90,20,Hits 2-5 times in one turn. Boosts user's Speed but lowers its Defense.
Scorching Sands,Ground,Special,70,100,10,May burn the target.
Shell Side Arm,Poison,Special,,,,"May poison opponent. Inflicts either Special or Physical damage, whichever is better."
Skitter Smack,Bug,Physical,70,90,10,Lowers opponent's Sp. Attack.
Snap Trap,Grass,Physical,35,100,15,"Traps opponent, damaging them for 4-5 turns."
Snipe Shot,Water,Special,80,100,15,Ignores moves and abilities that draw in moves. High critical hit ratio.
Spirit Break,Fairy,Physical,75,100,15,Lowers opponent's Special Attack.
Steel Beam,Steel,Special,140,95,5,User loses 50% of its HP.
Steel Roller,Steel,Physical,130,100,5,Fails if no Terrain in effect.
Strange Steam,Fairy,Special,90,95,10,May confuse opponent.
Stuff Cheeks,Normal,Status,,,10,"The user eats its held Berry, then sharply raises its Defense stat."
Surging Strikes,Water,,,,,Always results in a critical hit and ignores stat changes.
Tar Shot,Rock,Status,,100,15,Lowers the opponent's Speed and makes them weaker to Fire-type moves.
Teatime,Normal,Status,,,10,Forces all Pokémon on the field to eat their berries.
Terrain Pulse,Normal,Special,50,100,10,Type and power change depending on the Terrain in effect.
Thunder Cage,Electric,,,,,"Deals damage and traps opponent, damaging them for 4-5 turns."
Thunderous Kick,Fighting,Physical,,,,Lowers opponent's Defense.
Triple Axel,Ice,Physical,20,90,10,Attacks thrice with more power each time.
Wicked Blow,Dark,,,,,Always results in a critical hit and ignores stat changes.
